{
  "schemaVersion": 2,
  "entityType": "media",
  "chunk": 2,
  "maxRecords": 250,
  "records": [
    {
      "id": "media-abarth-500e-cover",
      "ownerType": "model",
      "ownerId": "abarth/500e",
      "role": "canonical_cover",
      "sourceId": "src-commons-abarth-500e-cover",
      "originalUrl": "https://commons.wikimedia.org/wiki/Special:Redirect/file/Abarth_500e_(2025)_(54715762522).jpg",
      "pageUrl": "https://commons.wikimedia.org/wiki/File:Abarth_500e_(2025)_(54715762522).jpg",
      "license": "CC0 1.0",
      "attribution": "Charles from Port Chester, New York, via Wikimedia Commons",
      "identityStatus": "exact_model",
      "status": "approved",
      "verifiedAt": "2026-08-16"
    },
    {
      "id": "media-acura-zdx-cover",
      "ownerType": "model",
      "ownerId": "acura/zdx",
      "role": "canonical_cover",
      "sourceId": "src-commons-acura-zdx-cover",
      "originalUrl": "https://commons.wikimedia.org/wiki/Special:Redirect/file/2024_Acura_ZDX_Type_S_in_Cosmic_Black_Metallic%2C_front_right%2C_2024-11-06.jpg",
      "pageUrl": "https://commons.wikimedia.org/wiki/File:2024_Acura_ZDX_Type_S_in_Cosmic_Black_Metallic,_front_right,_2024-11-06.jpg",
      "license": "CC BY-SA 4.0",
      "attribution": "Elise240SX, via Wikimedia Commons",
      "identityStatus": "exact_generation",
      "status": "approved",
      "verifiedAt": "2026-08-16"
    },
    {
      "id": "media-aito-m9-cover",
      "ownerType": "model",
      "ownerId": "aito/m9",
      "role": "canonical_cover",
      "sourceId": "src-commons-aito-m9-cover",
      "originalUrl": "https://commons.wikimedia.org/wiki/Special:Redirect/file/AITO_M9_MY2025_20260117_003.jpg",
      "pageUrl": "https://commons.wikimedia.org/wiki/File:AITO_M9_MY2025_20260117_003.jpg",
      "license": "CC BY-SA 4.0",
      "attribution": "RichardBi0129, via Wikimedia Commons",
      "identityStatus": "exact_model",
      "status": "approved",
      "verifiedAt": "2026-08-16"
    },
    {
      "id": "media-alfa-romeo-junior-cover",
      "ownerType": "model",
      "ownerId": "alfa-romeo/junior",
      "role": "canonical_cover",
      "sourceId": "src-commons-alfa-romeo-junior-cover",
      "originalUrl": "https://commons.wikimedia.org/wiki/Special:Redirect/file/2024_Alfa_Romeo_Junior.jpg",
      "pageUrl": "https://commons.wikimedia.org/wiki/File:2024_Alfa_Romeo_Junior.jpg",
      "license": "CC0 1.0",
      "attribution": "Calreyn88, via Wikimedia Commons",
      "identityStatus": "exact_model",
      "status": "approved",
      "verifiedAt": "2026-08-16"
    },
    {
      "id": "media-aston-martin-db12-cover",
      "ownerType": "model",
      "ownerId": "aston-martin/db12",
      "role": "canonical_cover",
      "sourceId": "src-commons-aston-martin-db12-cover",
      "originalUrl": "https://commons.wikimedia.org/wiki/Special:Redirect/file/Aston_Martin_DB12_(53687222626).jpg",
      "pageUrl": "https://commons.wikimedia.org/wiki/File:Aston_Martin_DB12_(53687222626).jpg",
      "license": "CC BY-SA 2.0",
      "attribution": "Alexandre Prevot, via Wikimedia Commons",
      "identityStatus": "exact_model",
      "status": "approved",
      "verifiedAt": "2026-08-16"
    },
    {
      "id": "media-audi-q6-cover",
      "ownerType": "model",
      "ownerId": "audi/q6-e-tron",
      "role": "canonical_cover",
      "sourceId": "src-commons-audi-q6-cover",
      "originalUrl": "https://commons.wikimedia.org/wiki/Special:Redirect/file/Audi_Q6_e-tron_IAA_2023_1X7A0056.jpg",
      "pageUrl": "https://commons.wikimedia.org/wiki/File:Audi_Q6_e-tron_IAA_2023_1X7A0056.jpg",
      "license": "CC BY-SA 4.0",
      "attribution": "Alexander Migl (Alexander-93), via Wikimedia Commons",
      "identityStatus": "exact_model",
      "status": "approved",
      "verifiedAt": "2026-08-15"
    },
    {
      "id": "media-avatr-12-cover",
      "ownerType": "model",
      "ownerId": "avatr/12",
      "role": "canonical_cover",
      "sourceId": "src-commons-avatr-12-cover",
      "originalUrl": "https://commons.wikimedia.org/wiki/Special:Redirect/file/Avatr_12_008.jpg",
      "pageUrl": "https://commons.wikimedia.org/wiki/File:Avatr_12_008.jpg",
      "license": "CC0 1.0",
      "attribution": "JustAnotherCarDesigner, via Wikimedia Commons",
      "identityStatus": "exact_model",
      "status": "approved",
      "verifiedAt": "2026-08-16"
    },
    {
      "id": "media-baic-x55-cover",
      "ownerType": "model",
      "ownerId": "baic/x55",
      "role": "canonical_cover",
      "sourceId": "src-commons-baic-x55-cover",
      "originalUrl": "https://commons.wikimedia.org/wiki/Special:Redirect/file/BAIC_(Beijing)_X55_162315.jpg",
      "pageUrl": "https://commons.wikimedia.org/wiki/File:BAIC_(Beijing)_X55_162315.jpg",
      "license": "CC0 1.0",
      "attribution": "Trop86, via Wikimedia Commons",
      "identityStatus": "exact_model",
      "status": "approved",
      "verifiedAt": "2026-08-16"
    },
    {
      "id": "media-baojun-yep-cover",
      "ownerType": "model",
      "ownerId": "baojun/yep",
      "role": "canonical_cover",
      "sourceId": "src-commons-baojun-yep-cover",
      "originalUrl": "https://commons.wikimedia.org/wiki/Special:Redirect/file/Baojun_Yep_008.jpg",
      "pageUrl": "https://commons.wikimedia.org/wiki/File:Baojun_Yep_008.jpg",
      "license": "CC BY-SA 4.0",
      "attribution": "JustAnotherCarDesigner, via Wikimedia Commons",
      "identityStatus": "exact_model",
      "status": "approved",
      "verifiedAt": "2026-08-16"
    },
    {
      "id": "media-baw-ruisheng-m8-cover",
      "ownerType": "model",
      "ownerId": "baw/ruisheng-m8",
      "role": "canonical_cover",
      "sourceId": "src-commons-baw-ruisheng-m8-cover",
      "originalUrl": "https://commons.wikimedia.org/wiki/Special:Redirect/file/BAW_Ruisheng_M8_001.jpg",
      "pageUrl": "https://commons.wikimedia.org/wiki/File:BAW_Ruisheng_M8_001.jpg",
      "license": "CC0 1.0",
      "attribution": "JustAnotherCarDesigner, via Wikimedia Commons",
      "identityStatus": "exact_model",
      "status": "approved",
      "verifiedAt": "2026-08-16"
    },
    {
      "id": "media-belgee-x50-cover",
      "ownerType": "model",
      "ownerId": "belgee/x50",
      "role": "canonical_cover",
      "sourceId": "src-commons-belgee-x50-cover",
      "originalUrl": "https://commons.wikimedia.org/wiki/Special:Redirect/file/BELGEE_X50_front.jpg",
      "pageUrl": "https://commons.wikimedia.org/wiki/File:BELGEE_X50_front.jpg",
      "license": "CC0 1.0",
      "attribution": "NOhead87, via Wikimedia Commons",
      "identityStatus": "exact_model",
      "status": "approved",
      "verifiedAt": "2026-08-16"
    },
    {
      "id": "media-bentley-continental-gt-cover",
      "ownerType": "model",
      "ownerId": "bentley/continental-gt",
      "role": "canonical_cover",
      "sourceId": "src-commons-bentley-continental-gt-cover",
      "originalUrl": "https://commons.wikimedia.org/wiki/Special:Redirect/file/2024_Bentley_Continental_GT_Speed_2.jpg",
      "pageUrl": "https://commons.wikimedia.org/wiki/File:2024_Bentley_Continental_GT_Speed_2.jpg",
      "license": "CC BY-SA 4.0",
      "attribution": "Calreyn88, via Wikimedia Commons",
      "identityStatus": "exact_generation",
      "status": "approved",
      "verifiedAt": "2026-08-16"
    },
    {
      "id": "media-bestune-t90-cover",
      "ownerType": "model",
      "ownerId": "bestune/t90",
      "role": "canonical_cover",
      "sourceId": "src-commons-bestune-t90-cover",
      "originalUrl": "https://commons.wikimedia.org/wiki/Special:Redirect/file/Bestune_T90_001.jpg",
      "pageUrl": "https://commons.wikimedia.org/wiki/File:Bestune_T90_001.jpg",
      "license": "CC BY-SA 4.0",
      "attribution": "JustAnotherCarDesigner, via Wikimedia Commons",
      "identityStatus": "exact_model",
      "status": "approved",
      "verifiedAt": "2026-08-16"
    },
    {
      "id": "media-bmw-i4-cover",
      "ownerType": "model",
      "ownerId": "bmw/i4",
      "role": "canonical_cover",
      "sourceId": "src-commons-bmw-i4-cover",
      "originalUrl": "https://commons.wikimedia.org/wiki/Special:Redirect/file/BMW_i4_eDrive40_M_Sport_%28G26%29_front.jpg",
      "pageUrl": "https://commons.wikimedia.org/wiki/File:BMW_i4_eDrive40_M_Sport_(G26)_front.jpg",
      "license": "CC BY-SA 4.0",
      "attribution": "Tokumeigakarinoaoshima, via Wikimedia Commons",
      "identityStatus": "exact_generation",
      "status": "approved",
      "verifiedAt": "2026-08-15"
    },
    {
      "id": "media-buick-envista-cover",
      "ownerType": "model",
      "ownerId": "buick/envista",
      "role": "canonical_cover",
      "sourceId": "src-commons-buick-envista-cover",
      "originalUrl": "https://commons.wikimedia.org/wiki/Special:Redirect/file/Buick_Envista_002_(cropped).jpg",
      "pageUrl": "https://commons.wikimedia.org/wiki/File:Buick_Envista_002_(cropped).jpg",
      "license": "CC BY-SA 4.0",
      "attribution": "Elizbeth smith, via Wikimedia Commons",
      "identityStatus": "exact_model",
      "status": "approved",
      "verifiedAt": "2026-08-16"
    },
    {
      "id": "media-byd-seal-cover",
      "ownerType": "model",
      "ownerId": "byd/seal",
      "role": "canonical_cover",
      "sourceId": "src-commons-byd-seal-cover",
      "originalUrl": "https://commons.wikimedia.org/wiki/Special:Redirect/file/2023_BYD_Seal_front.jpg",
      "pageUrl": "https://commons.wikimedia.org/wiki/File:2023_BYD_Seal_front.jpg",
      "license": "CC BY 2.0",
      "attribution": "Rutger van der Maar, via Wikimedia Commons",
      "identityStatus": "exact_model",
      "status": "approved",
      "verifiedAt": "2026-08-15"
    },
    {
      "id": "media-cadillac-lyriq-cover",
      "ownerType": "model",
      "ownerId": "cadillac/lyriq",
      "role": "canonical_cover",
      "sourceId": "src-commons-cadillac-lyriq-cover",
      "originalUrl": "https://commons.wikimedia.org/wiki/Special:Redirect/file/CADILLAC_LYRIQ_China.jpg",